{
  "assets": [
    {
      "anchor_id": "TAB-0001",
      "paths": [
        "assets/TAB-0001.csv",
        "assets/TAB-0001.json"
      ],
      "type": "table"
    }
  ],
  "extractor": {
    "name": "docling",
    "version": "2.112.0"
  },
  "parse_verification": {
    "report_path": "parse-verification-report.json",
    "status": "passed",
    "unresolved_anchor_count": 0
  },
  "schema_version": "1.0",
  "source": {
    "pdf_path": "paper.pdf",
    "pdf_sha256": "bbbbbbbbbbbbbbbbbbbbbbbbbbbbbbbbbbbbbbbbbbbbbbbbbbbbbbbbbbbbbbbb"
  },
  "summary": {
    "anchor_count": 1,
    "asset_count": 2,
    "mean_confidence": 0.99,
    "minimum_confidence": 0.99
  },
  "suspicious_instruction_evidence": [],
  "uncertain_regions": []
}
